{
  "$schema": "../static/jsonschema/core/service_provider_config.json",
  "patch": {
    "supported": true
  },
  "bulk": {
    "supported": false,
    "maxOperations": 0,
    "maxPayloadSize": 0
  },
  "authenticationSchemes": [],
  "changePassword": {
    "supported": false
  },
  "documentationUri": "https://example.com/docs",
  "etag": {
    "supported": false
  },
  "filter": {
    "supported": true,
    "maxResults": 100
  },
  "sort": {
    "supported": false
  }
}
